article_id,title,body,source,published_at,url
d7ab3cbb-7f50-4690-88c0-cc3b26e139f5,"Central Railway Sports Persons – part of the Indian Olympic Contingent for the Paris 2024 Olympics in Paris, France","Central Railway is proud to announce that two of its Sportspersons are part of the Indian Olympic Contingent for the Paris 2024 Olympic Games held in Paris, France from 26.7.2024 to 11.8.2024.

Swapnil Khusale, and Ms Ankita Dhyani, members of the Central Railway Sports Association and working as Commercial cum Ticket Clerks in Pune Division and Mumbai Division respectively are part of the Indian Olympic Team for the Paris-2024 Olympics.

Swapnil Khusale, is a Sport Shooter from Maharashtra and an employee of Central Railway. He made it to the Indian team for Paris Olympics 2024 in the 50m rifle 3 positions event. Earlier in 2022, he won the Olympic quota berth in the men’s 50-metre rifle 3-position event with a fourth place at the World championship in Cairo, Egypt on 22 October.

He has won Gold medals in Shooting in Asian Games at China in 2023, World Cup at Baku in 2022 and at New Delhi in 2021. Besides he has won Silver and Bronze medals in various Shooting Championships from 2015 to 2023.

He will represent India in the Shooting event in Paris 2024 Olympics.

Ms Ankita Dhyani is an Indian athlete from Uttarakhand and an employee of Central Railways.. She is a middle-distance and long-distance runner. She has qualified for the Paris 2024 Olympic Games at Paris and is representing India in the women's 5000m event. Earlier in 2022, she was named in the Indian athletics team for the 5000m event in the 2022 Asian Games at Hangzhou, China.

She has won the Gold medal in the 26th National Federation Cup Senior Athletics, 17th, 18th and 19th Federation Cup Junior athletics Championship and the 33rd, 34th, 35th and 36th National Junior Athletics Championships. She has also won Silver medal in National Federation Cup in 2022 and Bronze medals in National Interstate Senior Athletes Championship in 2021 & 2023.

She will represent India in the women's 5000m event in Paris 2024 Olympics.

Conveying his best wishes to the Sportspersons, Ram Karan Yadav, General Manager, Central Railway said"" It is a matter of pride for Central Railway and Indian Railways that their Sportspersons are part of the prestigious Olympic Team and will be representing the country in their respective sport events”.

He said that sports require very rigorous regime of mental and physical fitness, complete focus and discipline in life. Spirit of sports is to have a strong desire to excel and achieve the best.

Central Railway has been very active in providing the best facilities to its sportspersons. The Sportspersons owe their success and achievements to the Central Railway Sports Association (CRSA). It is one such body dedicated to recruit, promote, coach and encourage budding sports persons to achieve their dreams and bring laurels for Railways and for the Country. CRSA also has plans of starting a curriculum in Central Railway Schools to groom and hunt young talent that have medal potential in National and International forums.",freepressjournal.in,2024-07-31T10:52:39.000000Z,https://www.freepressjournal.in/corporate-gallery/central-railway-sports-persons-part-of-the-indian-olympic-contingent-for-the-paris-2024-olympics-in-paris-france
7989405d-9b85-4947-9c90-c8beb911c36e,IOC warns Afghanistan about Paris Olympics status over denying sports to women and girls,"By GRAHAM DUNBAR

The requested article has expired, and is no longer available. Any related articles, and user comments are shown below.

© Copyright 2023 The Associated Press. All rights reserved. This material may not be published, broadcast, rewritten or redistributed without permission.",japantoday.com,2023-06-21T21:38:41.000000Z,https://japantoday.com/category/sports/ioc-warns-afghanistan-about-paris-olympics-status-over-denying-sports-to-women-and-girls
b34034ff-cb3e-428b-9d0e-c47591c1617f,The Paris Olympics horse-whipping scandal shows the dangers of ‘Disneyfication’ in horse sports,"Over the course of the 2024 Paris Olympics, Charlotte Dujardin went from being Great Britain’s most successful Olympics dressage rider to one of the most digitally shamed athletes in the history of the internet.

A video emerged which not only damaged Dujardin’s career but reignited debate around horse welfare in elite horse sports.

By the time the video was published online by mainstream media, it had already gone viral on Facebook.

The video shows Dujardin deliberately striking the legs of a student’s horse multiple times with a whip during a training session.

The footage is actually four years old, and questions have to be asked about the timing of its release during the Olympics. But both Dujardin, and elite level dressage, are now under intense public scrutiny.

The fallout

On her Facebook page, Dujardin apologised and withdrew from the Paris games.

She admitted she felt “deeply ashamed,” and acknowledged she should have “set a better example.”

But this did not stop the merciless online mobbing. Much of it came from fellow dressage riders desperate to distance themselves from what appears to be animal abuse.

The fallout has been immense.

Some activists and social media commentators have targeted other Olympic riders and the brands that sponsor them.

An online petition has also been started to remove horses from the Olympics.

On the other hand, some riders have taken issue with the treatment of Dujardin, claiming she has been unfairly framed. Some supporters have united on social media under the hashtag #istandwithcharlotte.

What are rule-makers doing?

At the time of writing, the International Federation for Equestrian Sports (FEI) is investigating the Dujardin incident. On its website the FEI is very clear about its commitment to prioritising horse welfare in horse sports.

Excessive use of whips is already prohibited in most horse sports.

Long before Paris 2024, reports recommended strengthening surveillance with regard to horse health and wellbeing in the Olympics. But how this would be enforced in private training barns is not clear.

The FEI has also been criticised for perceived failings in its response to earlier scandals, such as in 2021 when the coach of Germany’s modern pentathlon team was disqualified from the Tokyo Olympics for punching a horse.

That shameful scene was painful to watch but it should invoke some compassion for both horse and rider, who were clearly both suffering.

Why would a rider need to whip a horse?

In analysing the situation, it is time to move the discussion beyond online public shaming to consider animal agency and horse welfare.

Perhaps wisely, Dujardin has not attempted to explain or excuse her actions in her public statements so far. But this means we don’t know why she whipped the horse in the training session.

It is possible she was training the horse to perform the kind of extravagant movement which is routinely rewarded in dressage scores at the elite level.

Sadly, there are many more horses who suffer far worse abuse in other industries and settings, much of it also caught on film.

The reason Dujardin was dragged into a maelstrom of digital shaming so quickly was due in part to the special, emotional place of the show horse in our popular culture.

It was also due in part to who she is or was: a global sports celebrity who embodied the hopes and dreams of her fans.

Back in 2012 Dujardin was a hero – not just for winning gold in London. She also achieved the seemingly impossible feat of rising to the top of the international dressage scene without the financial and political backing of a wealthy family.

The horse she rode so elegantly, Valegro, also looked like he had stepped out of a fairytale.

The dangers of ‘Disneyfication’

Everyone in horse sports says they want to improve welfare standards and put horses first.

Those raised on Disney images of anthropomorphised horses might like to imagine these majestic creatures naturally choose to “dance” with their beloved owners to music in the dressage arena. But horses have to be trained to “dance” in this way, usually through the application of artificial aids and pressure.

Ironically, Dujardin herself had previously profited significantly from the wider “Disneyfication” of horses in our culture. In happier times, that collective fantasy fed into her narrative and celebrity brand as “The Girl on the Dancing Horse”.

Both social media and the mainstream media have long invested in stereotypical misrepresentations of female athletes as either magical princesses or ghastly villains.

A compassionate, multispecies approach to welfare would not treat horses as tools or trophies. Nor would it put human emotions and desires at the centre of horse welfare issues.

All of this is a stark reminder that it is humans, not horses, who dream of Olympic gold and glory.",theconversation.com,2024-08-09T03:51:16.000000Z,https://theconversation.com/the-paris-olympics-horse-whipping-scandal-shows-the-dangers-of-disneyfication-in-horse-sports-235672
05eb91aa-06e3-40b4-b3c6-cd19d7493df4,Paris Olympics promote sustainability for good reason: Climate change is putting athletes and their sports at risk,"Europe is in the midst of a heat wave, and while Olympic athletes in Paris for the 2024 Summer Games might be spared the worst of it, the weather will still be hot.

As global temperatures have risen, major sporting events like the Olympics and FIFA World Cup have had to adapt to high heat and extreme storms to keep athletes and fans safe and allow the games to go on.

Olympic organizers have moved events such as marathons to early mornings and even to cooler cities. FIFA, the governing body for world soccer, pushed the 2022 Men’s World Cup back from its usual time in June to late November so it could be held in Qatar.

The heat risks and the environmental impact of major sporting events have led some people to question whether these events should be held at all. But as someone who studies sport management and sustainability in an area I coined “sport ecology,” I believe that radical approach misses the benefits, including the Olympics’ ability to promote sustainable actions to the public worldwide.

How rising global heat affects the Olympics

Sports have good reason for caring about sustainability: Climate change can put athletes’ and fans’ health at risk and even put the future of some sports in doubt.

Winter sports face the greatest threats from climate change as temperatures rise and precipitation changes, dramatically shortening winter sports seasons in many areas. In 2022, the Beijing Winter Games had to artificially create snow so it could have ski runs at all. The International Olympic Committee has delayed its decision to select Winter Games host cities for 2030 and beyond because of the uncertainty of winter sports.

In the summer, global warming fuels extreme heat and storms that can affect the quality of the competition and the health of the athletes and spectators.

Major sport federations and leagues, as well as the Olympics, have responded to the risks by delaying competitions to cooler times of day or year, implementing water breaks and offering more player substitutions.

Organizers of the Tokyo Summer Games, held amid a fierce heat wave in 2021, had preemptively moved the marathon to Sapporo, more than 500 miles north of Tokyo, so athletes could run in cooler weather. They also delayed competitions during the Games to avoid extreme heat and excessive rain.

Olympic progress toward sustainability

Any large event like the Olympics can produce vast carbon emissions through its construction, transportation needs and energy use.

That impact, and the risks it creates for sports and their athletes, are why sustainability has been a pillar of the Olympic charter since 1996 and is a focus of its planning for the future. In 2012, the London Olympics pioneered a new international certification standard, ISO2012, which provides guidelines for any large event to make more sustainable choices, from construction to catering.

The 2024 Paris Games, from July 26 to Aug. 11, and Paralympic Games, Aug. 28 to Sept. 8, are certified to the latest standard, and organizers are taking many steps to reduce their climate impact.

The organizers plan to power the events’ operations with 100% renewable energy from wind and solar. They are using existing venues when possible, had new ones built with low-carbon concrete and recycled materials, and brought in thousands of seats made of recycled plastic.

All furniture and temporary buildings approved for the Games also must have a contractually guaranteed second life, rather than going into a landfill. All of the competition venues are on public transportation, allowing for fewer vehicles in the streets. Even the food is targeted for a 50% emissions cut compared with the average meal by increasing the use of plant-based foods. The Paralympics will use the same venues and housing in the weeks that follow.

That doesn’t mean the 2024 Olympics won’t have a large carbon footprint, however, particularly as many spectators and athletes arrive by plane. But the organizers are aiming for the construction and operations emissions to be half those of the London and Rio Games in 2012 and 2016.

World’s fair of sustainability

The Paris Olympic Games is an example of what large sporting events can do to reduce their impact on the environment and promote sustainability solutions to a global audience. Spectators will experience sustainability firsthand, and organizers will promote the Games’ sustainability efforts.

Such campaigns can influence people’s everyday behaviors and even increase their advocacy for sustainability in their home communities.

Suggestions to reduce the scale and size of sports events or even eliminate commercialized sports, ending spectator sports as we know them, overlook the ability of sports to influence and change human behavior.

Sustainability is a constantly evolving process of learning from the past to improve for the future.

The 2024 Olympics’ strategies, building on those used in previous events, and what Paris learns in carrying them out, will also help in planning for future events, including the 2028 Summer Games in Los Angeles.

In essence, the Olympic Games, the largest sporting event in the world, is a sport sustainability world’s fair. It highlights what is possible for a sporting event through collaborations with international corporations to reduce its environmental impact. And it influences others to follow suit, whether that is other sporting events, leagues and federations or spectators from around the world.",theconversation.com,2024-07-24T19:28:59.000000Z,https://theconversation.com/paris-olympics-promote-sustainability-for-good-reason-climate-change-is-putting-athletes-and-their-sports-at-risk-235075
20168874-a073-4a2e-9b67-3a3654247aa6,"Olympics 2036: India's 2036 Games bid a chance to boost infrastructure, says sports governance expert","Live Events





(You can now subscribe to our

(You can now subscribe to our Economic Times WhatsApp channel

India's bid to host the 2036 Olympic Games is a massive opportunity to ""turbo-charge"" investment in its infrastructure but it must ensure the benefits are shared across local communities, a sports governance expert said.The world's most populous nation has never hosted the Olympics, though New Delhi staged the Asian Games in 1951 and 1982 as well as the Commonwealth Games in 2010.The city of Ahmedabad in the western state of Gujarat is expected to be at the centre of India's plans to host the Games but a multi-city bid cannot be ruled out.Former FIFA Council member Moya Dodd , who previously served on the International Olympic Committee's (IOC) Athlete Entourage Commission, said developing the facilities needed to host the Olympics would have long-term benefits for the country.""Leaving the voting politics aside, it's a great opportunity to turbo-charge investment into sports infrastructure that'll be able to bear fruit for many years to come,"" Dodd said during the RCB Innovation Lab Indian Sports Summit on Friday.""Making sure those investments are the right ones in the right places, serving the right people, and taking a holistic view of that is a big opportunity, not just in hosting rights but also to improve communities that will be hosts.""Indonesia, Turkey and Chile have confirmed their intention to compete for the 2036 hosting rights, while several other countries including Egypt and South Korea are also expected to join the race.Former Australian soccer player Dodd said there had to be a legacy from hosting the Games.""It's important to ensure that the model imposed isn't one that's purely extractive of that country but one that's holistic and uplifts and leaves not just a legacy afterwards but actually delivers benefits along the way,"" she added.""That's important because we say that sport is this great phenomenon that is so wonderful and it's healthy and it's good for us all. Let's make sure that it doesn't bring suffering or disadvantage to anybody because of a major event that's come.""India has performed poorly at the Olympics, winning a total of 41 medals to date. The seven it bagged in Tokyo four years ago remains its biggest haul from a single Games.The country has won 10 gold medals, eight from hockey between 1928-1980, with one each from athletics and shooting.Former India hockey captain PR Sreejesh, who helped the team seal bronze medals in Tokyo 2021 and Paris 2024, said investment was needed to nurture the next generation of athletes.""At the grassroots level, there's a lot to work on,"" said Sreejesh, who retired after the Paris Games and now coaches India's junior men's team.""That's where the investment needs to go. If we're speaking about the 2036 Olympics, now is when we need to tap into talent between the age groups of 12-14 years.""",economictimes.indiatimes.com,2025-03-15T05:57:51.000000Z,https://economictimes.indiatimes.com/news/sports/olympics-2036-indias-2036-games-bid-a-chance-to-boost-infrastructure-says-sports-governance-expert/articleshow/119034006.cms
a4f764fe-1315-486e-8cc4-da6a233dcd91,Have the 2024 Olympics really changed the game for women in sports?,,koreatimes.co.kr,2024-08-11T14:05:05.000000Z,https://koreatimes.co.kr/www/nation/2024/08/773_380329.html
a63ad285-a0d1-45f7-83a7-7576c51b5fe4,"6 months from Olympics, Russians qualifying in some sports and absent in others","With just six months to go until the Paris Olympics, it's still not clear if Russians will be competing and, if so, how many.

Russians are qualifying for Olympic spots as ""neutral athletes"" in combat events such as judo and wrestling, but not in some of the Games' highest-profile events like track and field, swimming and gymnastics.

Russia is unhappy its competitors will compete without the national flag or anthem, and President Vladimir Putin said last month Russia was yet to decide whether to send athletes to the Paris Games, which start on July 26.

Ukrainian athletes are angered by what they see as some sports bodies bending the rules to allow Russians who support the war or have ties to the military to compete as ""neutrals.""

If Russians compete in Paris, there will be tension, just like at the world fencing championships, an Olympic qualifier, when Ukrainian fencer Olga Kharlan refused to shake hands after beating Russian ""neutral"" Anna Smirnova.

Smirnova staged a sitdown protest until the Ukrainian was disqualified, but the International Olympic Committee intervened and granted Kharlan a ""unique exception"" to compete at the Olympics.

How Russians can qualify

The IOC last year set up an ""Individual Neutral Athlete"" program for athletes from Russia and its military ally Belarus. They both were suspended from most Olympic sports a year earlier over the Russian invasion of Ukraine.

The process is run by the sports federations which organize their own qualifying competitions. The IOC wants them to exclude Russian and Belarusian athletes who are employed by the military or security services or who posted on social media supporting the war. The multitude of different rules across the Games' 32 sports mean exact numbers of those with ""neutral"" status are hard to verify.

The IOC says six Russians and five Belarusians have already qualified for Paris. There are many more qualifying events to come.

The IOC will appoint ""independent analysts"" for its own vetting, spokesman Mark Adams said last week.

""You can have some confidence that those people who have qualified will have already been through one process and then will be going through a second process run by the IOC but using an independent organization,"" Adams said.

Russian Olympic Committee president Stanislav Pozdnyakov told state news agency RIA Novosti on Wednesday he expected ""much stricter"" conditions and suggested the extra vetting meant the IOC ""doesn't fully trust the international sports federations.""

Pozdnyakov, seen above in 2021, said he expects strict vetting of Russian athletes ahead of the Olympics. (Pavel Golovkin/The Associated Press)

Which sports are Russians competing in?

Combat sports were especially enthusiastic about bringing back Russian competitors. Judo, fencing, wrestling and taekwondo led the way in admitting ""neutral athletes"" in 2023 and Russians have regularly competed in their Olympic qualifying events.

Different Russian sports bodies have taken varying approaches to the ""neutral athlete"" system, and there hasn't been a final decision from the government. Putin expressed concern in December that the rules could leave too many of Russia's top athletes ""cut out"" of the Games.

Influential gymnastics coach Valentina Rodionenko has told Russian media that Russia shouldn't enter World Cups unless the criteria are relaxed. International Gymnastics Federation records show it's granted ""neutral"" status to 30 people from Belarus including athletes, coaches and officials, but no Russians.

There are also no Russians expected to compete at the world swimming championships in Qatar next month, a key Olympic qualifier, though Belarus is set to send five swimmers.

The Russian governing bodies for gymnastics and swimming did not respond to a request for comment on whether any applications were filed for their athletes.

Russia has skipped Olympic weightlifting qualifiers in protest at a demand to sign a declaration which includes a pledge ""to abstain from expressing any support to the war."" Belarus has competed in those events.

Track and field never lifted its ban on Russian athletes. The IOC is blocking Russia and Belarus from team sports such as soccer, basketball or volleyball because it argues their involvement should be in ""individual"" events only, not as part of squads representing the country. Tennis doubles or two-person rowing crews might be approved, though.

Ukraine's concerns

Are sports federations following the rules? Ukraine says no.

More than 200 Ukrainian athletes including top soccer player Mykhailo Mudryk and high jump world champion Yaroslava Mahuchikh signed an open letter to French President Emmanuel Macron this month alleging three Russians who qualified for the Olympics as ""neutrals"" expressed support for the war.

""Allowing athletes from aggressor countries, who openly support Russia's armed aggression against Ukraine, violates the fundamental ethical principles declared by the Olympic Charter,"" the letter said.

Ukraine still opposes the IOC push for Russians to compete as neutrals but in July it dropped a policy that forced Ukrainian athletes to boycott events rather than compete against them.

Two Olympic gold medallists in taekwondo accused of posting on social media in support of the war were handed a ""probation period"" of three months by World Taekwondo but allowed to compete after that. United World Wrestling let three Olympic champions from Russia take part in its world championships because it judged they had been pressured into appearing at a pro-war rally in Moscow attended by Putin.

Switching nationality

At least some athletes from Russia — and who competed for Russia before the war — could be in Paris on the host French team.

There's European swimming champion Anastasiia Kirpichnikova, who switched allegiance from Russia to France in April, and Moscow-born Varvara Gracheva, who started representing France in June and has become France's second-highest ranked tennis player.",cbc.ca,2024-01-25T17:55:24.000000Z,https://www.cbc.ca/sports/olympics/olympics-russia-participation-1.7094590?cmp=rss
7d3ad1b9-8cfa-4a0c-a327-e2dfbc7ca8e6,Why The LA Olympics Will Be A Golden Moment For Women’s Sports,,forbes.com,2025-04-11T03:28:26.000000Z,https://www.forbes.com/sites/blythelawrence/2025/04/10/why-the-2028-olympics-are-poised-to-be-a-golden-moment-for-womens-sports/
a743491e-3e34-4560-88e6-9feef8c14d31,Some 180 Russian athletes may take part in 2024 Olympics — Sports Minister Matytsin,,tass.com,2023-05-02T17:29:12.000000Z,https://tass.com/sport/1612469
