article_id,title,body,source,published_at,url
70e6cdf3-dc82-4d38-a619-c51d7514cde2,"Olympics: Japan's athlete count to top 400, highest in overseas games","KYODO NEWS - Jul 1, 2024 - 20:49 | Sports, Olympics, All

More than 400 Japanese athletes are set to compete at the Paris Olympics this summer, the largest ever for the country at an Olympics held abroad, the Japanese Olympic Committee revealed Monday.

The number will surpass a record-high 339 seen at the 2008 Beijing Olympics as Japan qualified in team sports such as basketball, football and volleyball.

The country qualified at least one team in either the men's or women's competition of each team ball sport.

Japan has set a target of 20 gold medals, with its strength in judo, wrestling and urban sports, such as skateboarding.

At the Tokyo Olympics in 2021, 583 athletes represented the host country, and Japan won a record 27 gold medals.

Related coverage:

Olympics: Fencer Emura, breaker Nakarai named Japan's flag-bearers",english.kyodonews.net,2024-07-01T20:49:27.000000Z,https://english.kyodonews.net/news/2024/07/cbe95fa83f3f-olympics-japans-athlete-count-to-top-400-highest-in-overseas-games.html
f6657fbf-2792-4ea3-86a7-12e9efbfd019,Ukraine steps up efforts to exclude Russia from Olympics,"Country

United States of America US Virgin Islands United States Minor Outlying Islands Canada Mexico, United Mexican States Bahamas, Commonwealth of the Cuba, Republic of Dominican Republic Haiti, Republic of Jamaica Afghanistan Albania, People's Socialist Republic of Algeria, People's Democratic Republic of American Samoa Andorra, Principality of Angola, Republic of Anguilla Antarctica (the territory South of 60 deg S) Antigua and Barbuda Argentina, Argentine Republic Armenia Aruba Australia, Commonwealth of Austria, Republic of Azerbaijan, Republic of Bahrain, Kingdom of Bangladesh, People's Republic of Barbados Belarus Belgium, Kingdom of Belize Benin, People's Republic of Bermuda Bhutan, Kingdom of Bolivia, Republic of Bosnia and Herzegovina Botswana, Republic of Bouvet Island (Bouvetoya) Brazil, Federative Republic of British Indian Ocean Territory (Chagos Archipelago) British Virgin Islands Brunei Darussalam Bulgaria, People's Republic of Burkina Faso Burundi, Republic of Cambodia, Kingdom of Cameroon, United Republic of Cape Verde, Republic of Cayman Islands Central African Republic Chad, Republic of Chile, Republic of China, People's Republic of Christmas Island Cocos (Keeling) Islands Colombia, Republic of Comoros, Union of the Congo, Democratic Republic of Congo, People's Republic of Cook Islands Costa Rica, Republic of Cote D'Ivoire, Ivory Coast, Republic of the Cyprus, Republic of Czech Republic Denmark, Kingdom of Djibouti, Republic of Dominica, Commonwealth of Ecuador, Republic of Egypt, Arab Republic of El Salvador, Republic of Equatorial Guinea, Republic of Eritrea Estonia Ethiopia Faeroe Islands Falkland Islands (Malvinas) Fiji, Republic of the Fiji Islands Finland, Republic of France, French Republic French Guiana French Polynesia French Southern Territories Gabon, Gabonese Republic Gambia, Republic of the Georgia Germany Ghana, Republic of Gibraltar Greece, Hellenic Republic Greenland Grenada Guadaloupe Guam Guatemala, Republic of Guinea, Revolutionary People's Rep'c of Guinea-Bissau, Republic of Guyana, Republic of Heard and McDonald Islands Holy See (Vatican City State) Honduras, Republic of Hong Kong, Special Administrative Region of China Hrvatska (Croatia) Hungary, Hungarian People's Republic Iceland, Republic of India, Republic of Indonesia, Republic of Iran, Islamic Republic of Iraq, Republic of Ireland Israel, State of Italy, Italian Republic Japan Jordan, Hashemite Kingdom of Kazakhstan, Republic of Kenya, Republic of Kiribati, Republic of Korea, Democratic People's Republic of Korea, Republic of Kuwait, State of Kyrgyz Republic Lao People's Democratic Republic Latvia Lebanon, Lebanese Republic Lesotho, Kingdom of Liberia, Republic of Libyan Arab Jamahiriya Liechtenstein, Principality of Lithuania Luxembourg, Grand Duchy of Macao, Special Administrative Region of China Macedonia, the former Yugoslav Republic of Madagascar, Republic of Malawi, Republic of Malaysia Maldives, Republic of Mali, Republic of Malta, Republic of Marshall Islands Martinique Mauritania, Islamic Republic of Mauritius Mayotte Micronesia, Federated States of Moldova, Republic of Monaco, Principality of Mongolia, Mongolian People's Republic Montserrat Morocco, Kingdom of Mozambique, People's Republic of Myanmar Namibia Nauru, Republic of Nepal, Kingdom of Netherlands Antilles Netherlands, Kingdom of the New Caledonia New Zealand Nicaragua, Republic of Niger, Republic of the Nigeria, Federal Republic of Niue, Republic of Norfolk Island Northern Mariana Islands Norway, Kingdom of Oman, Sultanate of Pakistan, Islamic Republic of Palau Palestinian Territory, Occupied Panama, Republic of Papua New Guinea Paraguay, Republic of Peru, Republic of Philippines, Republic of the Pitcairn Island Poland, Polish People's Republic Portugal, Portuguese Republic Puerto Rico Qatar, State of Reunion Romania, Socialist Republic of Russian Federation Rwanda, Rwandese Republic Samoa, Independent State of San Marino, Republic of Sao Tome and Principe, Democratic Republic of Saudi Arabia, Kingdom of Senegal, Republic of Serbia and Montenegro Seychelles, Republic of Sierra Leone, Republic of Singapore, Republic of Slovakia (Slovak Republic) Slovenia Solomon Islands Somalia, Somali Republic South Africa, Republic of South Georgia and the South Sandwich Islands Spain, Spanish State Sri Lanka, Democratic Socialist Republic of St. Helena St. Kitts and Nevis St. Lucia St. Pierre and Miquelon St. Vincent and the Grenadines Sudan, Democratic Republic of the Suriname, Republic of Svalbard & Jan Mayen Islands Swaziland, Kingdom of Sweden, Kingdom of Switzerland, Swiss Confederation Syrian Arab Republic Taiwan, Province of China Tajikistan Tanzania, United Republic of Thailand, Kingdom of Timor-Leste, Democratic Republic of Togo, Togolese Republic Tokelau (Tokelau Islands) Tonga, Kingdom of Trinidad and Tobago, Republic of Tunisia, Republic of Turkey, Republic of Turkmenistan Turks and Caicos Islands Tuvalu Uganda, Republic of Ukraine United Arab Emirates United Kingdom of Great Britain & N. Ireland Uruguay, Eastern Republic of Uzbekistan Vanuatu Venezuela, Bolivarian Republic of Viet Nam, Socialist Republic of Wallis and Futuna Islands Western Sahara Yemen Zambia, Republic of Zimbabwe",thestar.com,2023-02-03T13:27:51.000000Z,https://www.thestar.com/news/world/europe/2023/02/03/ukraine-steps-up-efforts-to-exclude-russia-from-olympics.html
1fb10a2a-bb5d-4188-b5e8-9f71689fb8dc,The Paris Olympics are expected to provide sportsbooks with a major boost,,seekingalpha.com,2024-07-28T16:34:52.000000Z,https://seekingalpha.com/news/4129275-the-paris-olympics-are-expected-to-provide-sportsbooks-with-a-major-boost
1f0aeed5-314b-4aae-b6bd-540882f251ff,"Months out from Paris Olympics, Russians are qualifying in some sports and absent in others","By JAMES ELLINGWORTH

The requested article has expired, and is no longer available. Any related articles, and user comments are shown below.

© Copyright 2024 The Associated Press. All rights reserved. This material may not be published, broadcast, rewritten or redistributed without permission.",japantoday.com,2024-01-25T21:41:20.000000Z,https://japantoday.com/category/sports/months-out-from-paris-olympics-russians-are-qualifying-in-some-sports-and-absent-in-others
2272840c-36ad-405c-968c-185b706d3a47,Ex-Tokyo Olympics organizing committee exec denies bribery charges,"KYODO NEWS - Dec 14, 2023 - 15:07 | Sports, Olympics, All

A former executive of the Tokyo Olympics organizing committee on Thursday pleaded not guilty to receiving bribes totaling around 198 million yen ($1.4 million) in connection with the 2021 Summer Games.

Haruyuki Takahashi said he is ""innocent"" of all charges at the opening of his trial at the Tokyo District Court. The 79-year-old is accused of receiving bribes from five different sources between 2017 and 2022 in return for helping companies land Olympic sponsorships.

Takahashi, a former senior managing director of Japan's largest advertising agency Dentsu Inc., was considered an authority on the sports business.

He is believed to have received bribes from business suit retailer Aoki Holdings Inc. and publisher Kadokawa Corp., among other sources, according to the indictment.

A series of trials have so far found 10 people guilty of paying bribes in connection with the Olympics, and one has been found guilty of receiving them.

Related coverage:

Ex-Tokyo Olympics operations executive found guilty of bid-rigging

Olympics: Sapporo left out as IOC signals 2030, 2034 games hosts

Sapporo's 2030 Winter Olympics bid dropped, 2034 or later targeted",english.kyodonews.net,2023-12-14T15:07:00.000000Z,https://english.kyodonews.net/news/2023/12/d80e12b31028-ex-tokyo-olympics-organizing-committee-exec-denies-bribery-charges.html
8a0915d5-24cc-4158-8620-ad43babb3a08,"Paris Olympics 2024: Bronze Medalist Swapnil Kusale's Coach Deepali Deshpande Says, 'There Is Lack Of Sports Culture In India'; Read Full Interview","Bronze winner Swapnil Kusale and his coach Deepali Deshpande |

Deepali Deshpande has been serving the shooting sport for almost 37 years. She represented India at the 2004 Olympics. The Mumbai-born shooter won silver in rifle shooting at the 2004 Asian Shooting Championships in Kuala Lumpur, Malaysia. She has been training several players after her retirement. She is the coach of Swapnil Kusale, who clinched bronze in the men’s 50m rifle 3 positions at the Paris Olympics 2024. After winning the medal, Swapnil said, “Deepali madam is like my second mother.” This one sentence conveys a thousand meanings. After Swapnil’s historic performance,

The Free Press Journal spoke to Deshpande.

Excerpts:

When did you start coaching Swapnil Kusale, and how did you recognise his potential?

In 2012, the NRAI (National Rifle Association of India) organised a programme for shooting players. I was the chief rifle coach for this programme. Swapnil participated as a junior shooter. I noticed his potential and provided training to him and other players. Through this programme, we formed various squads for national tournaments, and Swapnil was in the national squad for three years. I have been training him since then, even as he transitioned to senior levels.

What do you say about Swapnil’s journey, having closely observed his career?

Junior players often perform well because they lack other responsibilities and distractions. The transition from junior to senior is challenging for shooters. During Swapnil’s transition, I invited him to Delhi and Mumbai for training, as he was practising in Balewadi, Pune. My other students were in the north, so I was in Delhi, but I made sure to call Swapnil for training. I wanted his journey from junior to senior to be smooth.

Did you communicate with Swapnil before his maiden Olympic match?

Yes, I always talk to my students before any match. I could not go to Paris; I was in Mumbai when Swapnil played his match. But I communicated with him. Students always share their issues with me, and I provide them with guidance.

What are your thoughts on Swapnil’s delayed promotion by the railway authorities?

Some officers do not prioritise players and sports. Despite Swapnil’s excellent performance, he did not get a promotion for nine years. It was his right to be promoted. He had to visit the office and meet officers, which he found humiliating. I also felt bad for his future. We eventually decided to focus on his Olympic preparation and set aside concerns about the promotion.

Do you think our system is unsupportive of sportspersons?

The mentality in our society is not supportive enough. People were unaware of Swapnil’s achievements until he became an Olympic champion. He has been a top shooter since his junior days, but his past performances were overlooked. People often get impressed by social media but do not recognise the true athletes’ real performances. People said he came suddenly, as an underdog and all, but he had given the best performance in the past, which people do not acknowledge or see.

Do you think there is a lack of sports culture in our country?

The mentality towards sports in India has changed a lot, and we now see many players excelling in various games. I hope our players will do well in the Paris Olympics in other sports too. Sports in India have become more professional, and we have started performing at the international level, but there is still a lot to achieve. However, there is a lack of sports culture in our country. Sports require rules, and our civic sense is often lacking. People tend to break rules, which happens in every field. Spreading a sports culture across the country requires awareness and a change in mentality.

After the disappointing performance of Indian shooters in the Tokyo Olympics 2021, the NRAI did not renew your coaching contract. Did this upset you?

I was not bothered when I was removed from national coaching. Having been in the sport for several years, I understand how and why such incidents occur. I decided to focus on giving better training to my students. Although I could not go to Paris, Swapnil won the medal. Difficult times teach valuable lessons, and overcoming them makes one stronger. I still hold this belief.

What do you think about the facilities available for shooting sports in Mumbai?

Mumbai lacks adequate facilities for shooting sports. Existing facilities started long ago and have not been upgraded. In a city like Mumbai, the climate causes shooters’ equipment to rust. Mumbai could have better facilities. Currently, only Worli has a significant shooting range. While there is no vacant space for ranges within the city, authorities could build ranges in the outskirts like Thane, Navi Mumbai, and Virar.

Do you think Maharashtra lacks a sports culture, considering it took 72 years to win another Olympic medal after Khashaba Jadhav?

In Mumbai, people play sports to relieve stress, but dedicated players do emerge. However, the rest of Maharashtra lacks sports facilities. Authorities should maintain sports complexes like Balewadi, Pune, and provide access to players as they often keep them locked. Existing facilities should be used properly, and new ones should be built across the state.

How do you compare the era when you played to the current era in Indian sports?

When I was a player, participating in the Olympics was a major goal. We had quota selections. I participated in the Olympics after being selected by quota. Later, Rajyavardhan Singh Rathore and Abhinav Bindra won medals for the country, and our shooting infrastructure improved slightly, benefiting current players.",freepressjournal.in,2024-08-04T16:44:52.000000Z,https://www.freepressjournal.in/sports/paris-olympics-2024-bronze-medalist-swapnil-kusales-coach-deepali-deshpande-says-there-is-lack-of-sports-culture-in-india-read-full-interview
b25d072e-dd92-4084-8974-9178f7f46bb7,Ukraine steps up efforts to exclude Russia from Olympics,"Ukraine stepped up efforts Friday to lobby international sports leaders against Russian participation in next year’s Paris Olympics as indications mount that the games could see the biggest boycott since the Cold War.

A meeting of the Ukrainian Olympic Committee did not commit to a boycott but approved plans to consult with and persuade sports officials around the world over the next two months.

The committee members voted for “consultations on preventing the participation of Russian and Belarusian athletes in all international competitions and a possible boycott.” The International Olympic Committee is pushing to allow athletes from Russia and Belarus to compete at the 2024 Paris Games. They would take part without their national flags or anthems as “neutral athletes.” The IOC, which previously recommended excluding Russians and Belarusians from world sports on safety grounds, argues that it cannot discriminate against them purely based on citizenship, citing comments from United Nations officials.

Story continues below this ad

Ukraine wants Russia and Belarus to be banned from the Olympics entirely. Ukrainian President Volodymyr Zelenskyy has said any neutral flag would be “stained with blood.” Also Friday, the prime ministers of Estonia, Latvia and Lithuania urged the IOC to ban Russian athletes and said a boycott was a possibility.

Ukraine boycotted some sporting events last year rather than compete against Russians.

Speakers at the Ukrainian Olympic Committee’s assembly meeting Friday raised concerns about Russia using the event in Paris for propaganda and noted the close ties between some competitors and the country’s military.

White House press secretary Karine Jean-Pierre said Thursday that if athletes from the two countries compete, “it should be absolutely clear that they are not representing the Russian or Belarusian states.” The United States will host the 2028 Olympics in Los Angeles.

Story continues below this ad

If the IOC’s proposal takes effect, Paris would be the fourth Olympics in a row where Russian athletes have competed without the national flag or anthem. The Russian teams at the Winter Olympics in 2018 and 2022 and the Summer Olympics in 2021 were all caught up in the fallout from a years-long series of doping cases.

The last time multiple countries boycotted an Olympics was in 1988, when North Korea and others refused to attend the Summer Games in South Korea. The North Korean team was a no-show at the Tokyo Games in 2021, citing concerns about the coronavirus pandemic. The IOC barred it from the following Winter Games in Beijing as a result, saying that teams had a duty to attend every Olympics.",indianexpress.com,2023-02-03T15:40:58.000000Z,https://indianexpress.com/article/sports/sport-others/ukraine-steps-up-efforts-to-exclude-russia-from-olympics-8422807/
